{
  "$schema": "https://json-schema.org/draft/2020-12/schema",
  "$id": "https://workctx.dev/schemas/context.schema.json",
  "title": "Work Context configuration",
  "type": "object",
  "additionalProperties": false,
  "required": [
    "schema_version",
    "id",
    "name",
    "kind",
    "profile",
    "languages",
    "timezone",
    "classification",
    "security_boundary",
    "policies",
    "created_at",
    "updated_at"
  ],
  "properties": {
    "schema_version": {
      "type": "integer",
      "const": 1
    },
    "id": {
      "type": "string",
      "pattern": "^[a-z0-9]+(?:-[a-z0-9]+)*$",
      "minLength": 2,
      "maxLength": 64
    },
    "name": {
      "type": "string",
      "minLength": 1,
      "maxLength": 120
    },
    "kind": {
      "enum": [
        "company",
        "project",
        "product",
        "personal",
        "laboratory"
      ]
    },
    "profile": {
      "enum": [
        "light",
        "architect",
        "developer",
        "hybrid"
      ]
    },
    "languages": {
      "type": "object",
      "additionalProperties": false,
      "required": [
        "repository",
        "user_interaction"
      ],
      "properties": {
        "repository": {
          "type": "string",
          "const": "en"
        },
        "user_interaction": {
          "type": "string",
          "minLength": 2,
          "maxLength": 16
        }
      }
    },
    "timezone": {
      "type": "string",
      "minLength": 1
    },
    "classification": {
      "enum": [
        "public",
        "internal",
        "confidential",
        "restricted"
      ]
    },
    "security_boundary": {
      "type": "string",
      "const": "isolated"
    },
    "policies": {
      "type": "object",
      "additionalProperties": false,
      "required": [
        "local_mutations",
        "external_writes",
        "raw_evidence_retention",
        "federated_search"
      ],
      "properties": {
        "local_mutations": {
          "enum": [
            "review_required",
            "allowed_after_validation"
          ]
        },
        "external_writes": {
          "enum": [
            "never",
            "approval_required"
          ]
        },
        "raw_evidence_retention": {
          "enum": [
            "preserve",
            "preserve_with_redaction"
          ]
        },
        "federated_search": {
          "type": "boolean",
          "const": false
        }
      }
    },
    "created_at": {
      "type": "string",
      "format": "date-time"
    },
    "updated_at": {
      "type": "string",
      "format": "date-time"
    },
    "telemetry": {
      "type": "object",
      "additionalProperties": false,
      "description": "Opt-in machine-local usage telemetry; absent means fully disabled.",
      "properties": {
        "usage": {
          "type": "boolean",
          "default": false
        },
        "promotion_uses": {
          "type": "integer",
          "minimum": 1,
          "maximum": 1000,
          "default": 5
        },
        "decay_days": {
          "type": "integer",
          "minimum": 1,
          "maximum": 3650,
          "default": 60
        }
      }
    },
    "topics": {
      "type": "object",
      "additionalProperties": false,
      "description": "Computed topic-activity settings; heat is never authored.",
      "properties": {
        "heat_half_life_days": {
          "type": "integer",
          "minimum": 1,
          "maximum": 90,
          "default": 7
        }
      }
    },
    "working_dirs": {
      "type": "array",
      "description": "Top-level non-canonical working-output directories.",
      "default": [
        "outputs"
      ],
      "uniqueItems": true,
      "items": {
        "type": "string",
        "minLength": 1,
        "pattern": "^[^.][^/\\\\]*$",
        "not": {
          "enum": [
            "00_inbox",
            "01_processed",
            "02_knowledge",
            "03_work",
            "04_views",
            "05_outbox",
            "06_overrides",
            "90_integrations",
            "98_state",
            "99_meta"
          ]
        }
      }
    }
  }
}
