{
  "schema_version": 1,
  "id": "fictional-context",
  "name": "Fictional Context",
  "kind": "project",
  "profile": "hybrid",
  "languages": {
    "repository": "en",
    "user_interaction": "en"
  },
  "timezone": "UTC",
  "classification": "confidential",
  "security_boundary": "isolated",
  "policies": {
    "local_mutations": "review_required",
    "external_writes": "approval_required",
    "raw_evidence_retention": "preserve",
    "federated_search": false
  },
  "created_at": "2026-07-30T12:00:00Z",
  "updated_at": "2026-07-30T12:00:00Z"
}
